<?xml version="1.0" encoding="UTF-8"?>

<xs:schema
        targetNamespace="config-schema.xsd"
        elementFormDefault="qualified"
        xmlns="config-schema.xsd"
        xmlns:xs="http://www.w3.org/2001/XMLSchema">

    <xs:simpleType name="identifierType">
        <xs:restriction base="xs:token">
            <xs:pattern value="[a-zA-Z](\w|\.)*"/>
        </xs:restriction>
    </xs:simpleType>

    <xs:simpleType name="identifierTemplateType">
        <xs:restriction base="xs:token"/>
    </xs:simpleType>

    <xs:simpleType name="stringConstantNameStyle">
        <xs:restriction base="xs:token">
            <xs:enumeration value="camelcase"/>
            <xs:enumeration value="uppercase"/>
        </xs:restriction>
    </xs:simpleType>

    <xs:complexType name="annotationList">
        <xs:sequence>
            <xs:element name="annotation" type="identifierType" maxOccurs="unbounded"/>
        </xs:sequence>
    </xs:complexType>

    <xs:element name="basePackage" type="identifierType"/>

    <xs:element name="supportClasses">
        <xs:complexType>
            <xs:sequence>
                <xs:element ref="basePackage" minOccurs="1"/>
            </xs:sequence>
        </xs:complexType>
    </xs:element>

    <xs:element name="metadataClasses">
        <xs:complexType>
            <xs:sequence>
                <xs:element name="propertyClassName" type="identifierTemplateType" minOccurs="0"/>
                <xs:element name="relationshipClassName" type="identifierTemplateType" minOccurs="0"/>
                <xs:element name="stringConstantNameStyle" type="stringConstantNameStyle" minOccurs="0"/>
                <xs:element name="relationshipsClassTerminalMethodNameTemplate" type="identifierTemplateType"
                            minOccurs="0"/>
            </xs:sequence>
        </xs:complexType>
    </xs:element>

    <xs:element name="generationStyle">
        <xs:complexType>
            <xs:sequence>
                <xs:element ref="metadataClasses" maxOccurs="1" minOccurs="0"/>
            </xs:sequence>
        </xs:complexType>
    </xs:element>

    <xs:complexType name="packageList">
        <xs:sequence>
            <xs:element name="package" type="identifierType" minOccurs="0" maxOccurs="unbounded"/>
        </xs:sequence>
    </xs:complexType>

    <xs:element name="basePackages" type="packageList"/>

    <xs:element name="typeAnnotations" type="annotationList"/>

    <xs:element name="packageInfoAnnotations" type="annotationList"/>

    <xs:element name="includes">
        <xs:complexType>
            <xs:sequence>
                <xs:element ref="basePackages" minOccurs="0"/>
                <xs:element ref="typeAnnotations" minOccurs="0"/>
                <xs:element ref="packageInfoAnnotations" minOccurs="0"/>
            </xs:sequence>
        </xs:complexType>
    </xs:element>

    <xs:element name="pattern" type="xs:string"/>

    <xs:complexType name="patternList">
        <xs:sequence>
            <xs:element ref="pattern" minOccurs="0" maxOccurs="unbounded"/>
        </xs:sequence>
    </xs:complexType>

    <xs:element name="patterns" type="patternList"/>

    <xs:element name="excludes">
        <xs:complexType>
            <xs:sequence>
                <xs:element ref="typeAnnotations" minOccurs="0"/>
                <xs:element ref="patterns" minOccurs="0"/>
            </xs:sequence>
        </xs:complexType>
    </xs:element>

    <xs:element name="domain">
        <xs:complexType>
            <xs:sequence>
                <xs:element ref="includes"/>
                <xs:element ref="excludes" minOccurs="0"/>
            </xs:sequence>
        </xs:complexType>
    </xs:element>

    <xs:element name="beanProcessing">
        <xs:complexType>
            <xs:sequence>
                <xs:element ref="supportClasses"/>
                <xs:element ref="generationStyle"/>
                <xs:element ref="domain"/>
            </xs:sequence>
        </xs:complexType>
    </xs:element>

    <xs:element name="configuration">
        <xs:complexType>
            <xs:sequence>
                <xs:element ref="beanProcessing"/>
            </xs:sequence>
        </xs:complexType>
    </xs:element>
</xs:schema>
